"ID","Decision","Title","Contact given name","Contact family name","Contact Email","Document","Page length","Page size","Non-embedded fonts","Incomplete","Author list","Author emails","Author ID 1","Author given name or first name 1","Middle initial or name 1","Author last name or family name 1","Valid email address 1","Primary Affiliation (no labs or dept names in this field) 1 - Department/School/Lab","Primary Affiliation (no labs or dept names in this field) 1 - Institution","Primary Affiliation (no labs or dept names in this field) 1 - City","Primary Affiliation (no labs or dept names in this field) 1 - State or Province","Primary Affiliation (no labs or dept names in this field) 1 - Country","Secondary Affiliation (optional) (no labs or dept names in this field) 1 - Department/School/Lab","Secondary Affiliation (optional) (no labs or dept names in this field) 1 - Institution","Secondary Affiliation (optional) (no labs or dept names in this field) 1 - City","Secondary Affiliation (optional) (no labs or dept names in this field) 1 - State or Province","Secondary Affiliation (optional) (no labs or dept names in this field) 1 - Country","Author ID 2","Author given name or first name 2","Middle initial or name 2","Author last name or family name 2","Valid email address 2","Primary Affiliation (no labs or dept names in this field) 2 - Department/School/Lab","Primary Affiliation (no labs or dept names in this field) 2 - Institution","Primary Affiliation (no labs or dept names in this field) 2 - City","Primary Affiliation (no labs or dept names in this field) 2 - State or Province","Primary Affiliation (no labs or dept names in this field) 2 - Country","Secondary Affiliation (optional) (no labs or dept names in this field) 2 - Department/School/Lab","Secondary Affiliation (optional) (no labs or dept names in this field) 2 - Institution","Secondary Affiliation (optional) (no labs or dept names in this field) 2 - City","Secondary Affiliation (optional) (no labs or dept names in this field) 2 - State or Province","Secondary Affiliation (optional) (no labs or dept names in this field) 2 - Country","Author ID 3","Author given name or first name 3","Middle initial or name 3","Author last name or family name 3","Valid email address 3","Primary Affiliation (no labs or dept names in this field) 3 - Department/School/Lab","Primary Affiliation (no labs or dept names in this field) 3 - Institution","Primary Affiliation (no labs or dept names in this field) 3 - City","Primary Affiliation (no labs or dept names in this field) 3 - State or Province","Primary Affiliation (no labs or dept names in this field) 3 - Country","Secondary Affiliation (optional) (no labs or dept names in this field) 3 - Department/School/Lab","Secondary Affiliation (optional) (no labs or dept names in this field) 3 - Institution","Secondary Affiliation (optional) (no labs or dept names in this field) 3 - City","Secondary Affiliation (optional) (no labs or dept names in this field) 3 - State or Province","Secondary Affiliation (optional) (no labs or dept names in this field) 3 - Country","Author ID 4","Author given name or first name 4","Middle initial or name 4","Author last name or family name 4","Valid email address 4","Primary Affiliation (no labs or dept names in this field) 4 - Department/School/Lab","Primary Affiliation (no labs or dept names in this field) 4 - Institution","Primary Affiliation (no labs or dept names in this field) 4 - City","Primary Affiliation (no labs or dept names in this field) 4 - State or Province","Primary Affiliation (no labs or dept names in this field) 4 - Country","Secondary Affiliation (optional) (no labs or dept names in this field) 4 - Department/School/Lab","Secondary Affiliation (optional) (no labs or dept names in this field) 4 - Institution","Secondary Affiliation (optional) (no labs or dept names in this field) 4 - City","Secondary Affiliation (optional) (no labs or dept names in this field) 4 - State or Province","Secondary Affiliation (optional) (no labs or dept names in this field) 4 - Country","Author ID 5","Author given name or first name 5","Middle initial or name 5","Author last name or family name 5","Valid email address 5","Primary Affiliation (no labs or dept names in this field) 5 - Department/School/Lab","Primary Affiliation (no labs or dept names in this field) 5 - Institution","Primary Affiliation (no labs or dept names in this field) 5 - City","Primary Affiliation (no labs or dept names in this field) 5 - State or Province","Primary Affiliation (no labs or dept names in this field) 5 - Country","Secondary Affiliation (optional) (no labs or dept names in this field) 5 - Department/School/Lab","Secondary Affiliation (optional) (no labs or dept names in this field) 5 - Institution","Secondary Affiliation (optional) (no labs or dept names in this field) 5 - City","Secondary Affiliation (optional) (no labs or dept names in this field) 5 - State or Province","Secondary Affiliation (optional) (no labs or dept names in this field) 5 - Country","Author ID 6","Author given name or first name 6","Middle initial or name 6","Author last name or family name 6","Valid email address 6","Primary Affiliation (no labs or dept names in this field) 6 - Department/School/Lab","Primary Affiliation (no labs or dept names in this field) 6 - Institution","Primary Affiliation (no labs or dept names in this field) 6 - City","Primary Affiliation (no labs or dept names in this field) 6 - State or Province","Primary Affiliation (no labs or dept names in this field) 6 - Country","Secondary Affiliation (optional) (no labs or dept names in this field) 6 - Department/School/Lab","Secondary Affiliation (optional) (no labs or dept names in this field) 6 - Institution","Secondary Affiliation (optional) (no labs or dept names in this field) 6 - City","Secondary Affiliation (optional) (no labs or dept names in this field) 6 - State or Province","Secondary Affiliation (optional) (no labs or dept names in this field) 6 - Country","Author ID 7","Author given name or first name 7","Middle initial or name 7","Author last name or family name 7","Valid email address 7","Primary Affiliation (no labs or dept names in this field) 7 - Department/School/Lab","Primary Affiliation (no labs or dept names in this field) 7 - Institution","Primary Affiliation (no labs or dept names in this field) 7 - City","Primary Affiliation (no labs or dept names in this field) 7 - State or Province","Primary Affiliation (no labs or dept names in this field) 7 - Country","Secondary Affiliation (optional) (no labs or dept names in this field) 7 - Department/School/Lab","Secondary Affiliation (optional) (no labs or dept names in this field) 7 - Institution","Secondary Affiliation (optional) (no labs or dept names in this field) 7 - City","Secondary Affiliation (optional) (no labs or dept names in this field) 7 - State or Province","Secondary Affiliation (optional) (no labs or dept names in this field) 7 - Country","Author ID 8","Author given name or first name 8","Middle initial or name 8","Author last name or family name 8","Valid email address 8","Primary Affiliation (no labs or dept names in this field) 8 - Department/School/Lab","Primary Affiliation (no labs or dept names in this field) 8 - Institution","Primary Affiliation (no labs or dept names in this field) 8 - City","Primary Affiliation (no labs or dept names in this field) 8 - State or Province","Primary Affiliation (no labs or dept names in this field) 8 - Country","Secondary Affiliation (optional) (no labs or dept names in this field) 8 - Department/School/Lab","Secondary Affiliation (optional) (no labs or dept names in this field) 8 - Institution","Secondary Affiliation (optional) (no labs or dept names in this field) 8 - City","Secondary Affiliation (optional) (no labs or dept names in this field) 8 - State or Province","Secondary Affiliation (optional) (no labs or dept names in this field) 8 - Country","Author ID 9","Author given name or first name 9","Middle initial or name 9","Author last name or family name 9","Valid email address 9","Primary Affiliation (no labs or dept names in this field) 9 - Department/School/Lab","Primary Affiliation (no labs or dept names in this field) 9 - Institution","Primary Affiliation (no labs or dept names in this field) 9 - City","Primary Affiliation (no labs or dept names in this field) 9 - State or Province","Primary Affiliation (no labs or dept names in this field) 9 - Country","Secondary Affiliation (optional) (no labs or dept names in this field) 9 - Department/School/Lab","Secondary Affiliation (optional) (no labs or dept names in this field) 9 - Institution","Secondary Affiliation (optional) (no labs or dept names in this field) 9 - City","Secondary Affiliation (optional) (no labs or dept names in this field) 9 - State or Province","Secondary Affiliation (optional) (no labs or dept names in this field) 9 - Country","Author ID 10","Author given name or first name 10","Middle initial or name 10","Author last name or family name 10","Valid email address 10","Primary Affiliation (no labs or dept names in this field) 10 - Department/School/Lab","Primary Affiliation (no labs or dept names in this field) 10 - Institution","Primary Affiliation (no labs or dept names in this field) 10 - City","Primary Affiliation (no labs or dept names in this field) 10 - State or Province","Primary Affiliation (no labs or dept names in this field) 10 - Country","Secondary Affiliation (optional) (no labs or dept names in this field) 10 - Department/School/Lab","Secondary Affiliation (optional) (no labs or dept names in this field) 10 - Institution","Secondary Affiliation (optional) (no labs or dept names in this field) 10 - City","Secondary Affiliation (optional) (no labs or dept names in this field) 10 - State or Province","Secondary Affiliation (optional) (no labs or dept names in this field) 10 - Country","Contact Author Name","Contact Author Email Address","Abstract","References","Author Keywords","ACM Classifications","Document Source","Thumbnail Image","Auxiliary Material","Video Preview","Thumbnail Image Caption","Auxiliary Material Descriptive (Read me text) Information","Contribution & Benefit Statement (Mandatory Field)","Summary of Changes (only for Case Study required to change format/length/focus)","Video Preview Early Release (Required)","Final Content Accepted","Format Complete (Publications chair use only)","Grant Agency 1","Grant Number 1","Grant Agency 2","Grant Number 2","Grant Agency 3","Grant Number 3","Last Update","Notes"
"case115","A","12 Way Mirror –  Reflecting on Window Displays.","Lida","Theodorou","l.theodorou@se13.qmul.ac.uk","case0115-paper.pdf","8","letter","","","Lida Theodorou, Patrick G. T. Healey","l.theodorou@se13.qmul.ac.uk, ph@eecs.qmul.ac.uk","47487","Lida","","Theodorou","l.theodorou@se13.qmul.ac.uk","Media and Arts technology programme,School of Electronic Engineering and Computer Science","Queen-Mary University of London","London","","United Kingdom","","","","","","11121","Patrick","G. T.","Healey","ph@eecs.qmul.ac.uk","School of Electronic Engineering and Computer Science/Cognitive Science Research Group","Queen Mary University of London","London","","United Kingdom","","","","","","","","","","","","","","","","","","","","","","","","","","","","","","","","","","","","","","","","","","","","","","","","","","","","","","","","","","","","","","","","","","","","","","","","","","","","","","","","","","","","","","","","","","","","","","","","","","","","","","","","","","","","","","","","","","","","","","","","","","","","","","Lida Theodorou","l.theodorou@se13.qmul.ac.uk","Shop windows are the paradigmatic design environment for attracting and holding people’s attention. They also provide a handy mirror in which people can check their appearance. The 12-way mirror project plays with this duality by building and testing an interactive installation that tracks people’s reflections as they look into a shop window. Three versions of the installation are compared, one with static mirrors, one with moving mirrors and one with face-tracking mirrors. These were tested over a 5 day period in the window display of an Eyewear shop on a busy commercial road in East London. Data were collected on how many people looked in the window, for how long and what they did while looking. The results show that while movement attracts people’s attention and stops them, their own reflection is most effective in keeping their interest.","1. Alt, F., Schneega , S., Schmidt, A., M ller, J., & Memarovic, N. (2012). How to evaluate public displays. Proceedings of the 2012 International Symposium on Pervasive Displays - PerDis 12, 1 6. \ 2. Huang, E. M., Koster, A., & Borchers, J. (2011). Overcoming Assumptions and Uncovering Practices!: When Does the Public Really Look at Public Displays!?, 228 243. \ 3. M ller, J., Walter, R., Bailly, G., Nischt, M., & Alt, F. (2012). Looking Glass!: A Field Study on Noticing Interactivity of a Shop Window. \ 4. OpenCV Processing and Java library. (2013) [Online] Available at: http://ubaa.net/shared/processing/opencv/ [Accessed 13 August 2014]. \ 5. Reitberger, W., Meschtscherjakov, a., Mirlacher, T., Scherndl, T., Huber, H., & Tscheligi, M. (2009). A persuasive interactive mannequin for shop windows. Proceedings of the 4th International Conference on Persuasive Technology - Persuasive 09, 1. doi:10.1145/1541948.1541954 \ 6. Sch nb ck, J., K nig, F., Kotsis, G., Gruber, D., Zaim, E., & Schmidt, A. (2008). MirrorBoard An Interactive Billboard, 1 10 \ ","Pervasive advertising; Public engagement; Shop- window displays; Face-detection; Case Study","H.5.2 ","case0115-file1.docx","","","","","","Presents a case study of a public display installation that holds people’s attention and enhances their interaction with a shop window display. \ ","","early release","FinalAccept","","Engineering and Physical Sciences Research Council (EPSRC) ","","","","","","Jan  9 11:45",""
"case120","A","Artistic Distance: Body Movements as Launching Points For Art Inquiry","Kimiko","Ryokai","kimiko@ischool.berkeley.edu","case0120-paper.pdf","8","letter","","","Kimiko Ryokai, Noriko Misra, Yoshinori Hara","kimiko@ischool.berkeley.edu, noriko.misra@ischool.berkeley.edu, hara@gsm.kyoto-u.ac.jp","3175","Kimiko","","Ryokai","kimiko@ischool.berkeley.edu","School of Information","University of California, Berkeley","Berkeley","California","United States","","","","","","47464","Noriko","","Misra","noriko.misra@ischool.berkeley.edu","School of Information","UC Berkeley","Berkeley","CA","USA","","","","","","47748","Yoshinori","","Hara","hara@gsm.kyoto-u.ac.jp","Graduate School of Management","Kyoto University","Kyoto","Kyoto","Japan","","","","","","","","","","","","","","","","","","","","","","","","","","","","","","","","","","","","","","","","","","","","","","","","","","","","","","","","","","","","","","","","","","","","","","","","","","","","","","","","","","","","","","","","","","","","","","","","","","","","","","","","","","","","","","","Kimiko Ryokai","kimiko@berkeley.edu","How does the body matter in art observations? Do physical distances, movements, and perspectives influence the way one appreciates art? Do experts and novices use their body differently in engaging with art objects? We present results of our studies with 22 art experts and novices in two types of art, “Ikebana” (Japanese traditional flower arrangement) and abstract paintings. In both types of art, we observed that experts engaged with the art from multiple perspectives while exhibiting minimal movements around the art. Novices, in contrast, either hovered around the art looking for clues of interpretations or did not move at all due to lack of interest. We discuss implications for design of embodied systems that can support users with various levels of expertise. ","[1]	Candy, L. & Ferguson, S. (Eds.) 2014. Interactive Experience in the Digital Age: Evaluating New Art Practice, Springer Series on Cultural Computing, Springer: London.  \ [2]	Csikszentmihalyi, M. & Robinson, R.E. 1990. The Art of Seeing: An Interpretation of the Aesthetic Encounter, Malibu CA. \ [3]	Dewey, J. 1934. Art as Experience, New York, Capricorn Books, 1939, pp. 35-57. \ [4]	Dourish, P. 2004. What we talk about when we talk about context. Personal Ubiquitous Comp. 8, 1, 19-30. \ [5]	Garzotto, F. & Rizzo, F. 2007. Interaction paradigms in technology-enhanced social spaces: a case study in museums. In Proceedings of DPPI '07. ACM, NY, 343-356.  \ [6]	Goodwin, C. (1994). Professional Vision. American Anthropologist, Vol. 96, No. 3, pp. 606-633. \ [7]	Ju, W, Lee, B.A., & Klemmer, S.R. 2008. Range: exploring implicit interaction through electronic whiteboard design. In Proceedings of CSCW '08. ACM, NY, 17-26. \ [8]	Kortbek, K.J. & Grønbæk, K. 2008. Communicating art through interactive technology: new approaches for interaction design in art museums. In Proceedings of NordiCHI '08. ACM, NY, 229-238. \ [9]	Vogel, D. & Balakrishnan, R. 2004. Interactive public ambient displays: transitioning from implicit to explicit, public to personal, interaction with multiple users. In Proceedings of UIST '04. ACM, NY, 137-146.","Embodied interactions; art appreciation; expert perspectives","H.5.m","case0120-file1.docx","","","","","","We present studies with 22 art experts and novices in “Ikebana” and abstract paintings. We discuss design of embodied systems that support users with various levels of expertise.","","","FinalAccept","","","","","","","","Jan 12 19:52",""
"case128","A","Connective MOOC for K-12 Teacher Professional Development in Native American Pueblo Schools","Josephine","Kilde","josephine.kilde@colorado.edu","case0128-paper.pdf","8","letter","","","Josephine Kilde, Lorenzo Gonzales","josephine.kilde@colorado.edu, lxg@lanl.gov","34821","Josephine","","Kilde","josephine.kilde@colorado.edu","ATLAS Institute","University of Colorado Boulder","Boulder","Colorado","United States","","","","","","47558","Lorenzo","","Gonzales","lxg@lanl.gov","Los Alamos National Laboratory","Los Alamos National Laboratory","Los Alamos","New Mexico","United States","","","","","","","","","","","","","","","","","","","","","","","","","","","","","","","","","","","","","","","","","","","","","","","","","","","","","","","","","","","","","","","","","","","","","","","","","","","","","","","","","","","","","","","","","","","","","","","","","","","","","","","","","","","","","","","","","","","","","","","","","","","","","","Josephine Kilde","josephine.kilde@colorado.edu","This case study describes preliminary work toward developing a teacher training project that is intended to increase STEM proficiency among elementary and high school teachers in Native American Pueblo schools in New Mexico. This project builds upon prior work that trained K-12 teachers to use investigative teaching, which in turn had a significant positive impact on the math and science proficiency of Native American and Hispanic students. The current project seeks to use Connectivist Massive Open Course (cMOOC) technology to capture and scale this professional development through the use of video, imagery, and community building in order to integrate Native American learning processes.  The overall objective is to enable Pueblo teachers to more effectively teach STEM subject matter, as measured by an increase in both teacher and student content knowledge scores.  If successful, the use of these technologies should facilitate rapid expansion of the program in all Native American reservation schools in United States, Canada, and Mexico.","1. M. Sarche and P. Spicer, “Poverty and health disparities for American Indian and Alaska Native children: current knowledge and future prospects.,” Ann. N. Y. Acad. Sci., vol. 1136, pp. 126–36, Jan. 2008. \ 2. E. Guskin and A. Mitchell, “Innovating News in Native Communities,” State of the News Media, 2012. [Online]. Available: http://stateofthemedia.org/2012/native-americannews-media/. [Accessed: 29-Sep-2014]. \ 3. R. Mussa and K. Paul, “Poverty in Malawi-Current status and knowledge gaps,” no. December, 2011. \ 4. Ford Foundation, Native Arts and Cultures, 2010. [Online]. Available: http://www.fordfoundation.org/pdfs/library/NativeArts-and-Cultures.pdf. \ 5. H. Morgan, “What Every Teacher Needs To Know To Teach Native American Students,” pp. 10–12, 2006. \ 6. R. M. Felder and L. K. Silverman, “LEARNING AND TEACHING STYLES,” vol. 78, no. June, pp. 674– 681, 2002. \ 7. S. M. Hord, “Professional Learning Communities,” Natl. Staff Dev. Counc., vol. 30, no. 1, pp. 40–43, 2009. \ 8. Bureau of Indian Education. [Online]. Available: http://www.bie.edu/Schools/index.htm. [Accessed: 23-Jul-2013]. \ 9. Indian Affairs. [Online]. Available: http://www.bia.gov/. [Accessed: 24-Jul-2013]. \ 10. T. Bergeson, “Reading and the Native American Learner,” Rep. Evergr. State Coll., 2009. \ 11. M. Price, M. Kallam, and J. Love, “The Learning Styles of Native American Students and Implications for Classroom Practice,” no. 2008, 2009. \ 12. C. J. Marr, “Assimilation Through Education: Indian Boarding Schools in the Pacific Northwest,” University of Washington. [Online]. Available: https://content.lib.washington.edu/aipnw/marr.ht ml. [Accessed: 02-Sep-2014]. \ 13. C. Bear, “American Indian Boarding Schools Haunt Many,” NPR, 2008. [Online]. Available: http://www.npr.org/templates/story/story.php?stor yId=16516865. [Accessed: 02-Sep-2014]. \ 14. Indian Country Diaries: Indian Boarding Schools, Native American Public Telecommunications, 2006. [Online]. Available: http://www.pbs.org/indiancountry/history/boarding .html. [Accessed: 02-Sep-2014]. \ 15. The Indian Education Act of 1972, J. Am. Indian Educ., vol. 14, no. 2, 1975. \ 16. E. Osmundson and J. Herman, “Mathematics and Science Academy Year 6 Evaluation Report,” vol. 1522, no. January, 2007. \ 17. D. Ball and H. Hill, “Learning mathematics for teaching,” Ann Arbor, MI Univ. Michigan, no. 734, 2002. \ 18. A. Thieme, J. Vines, and J. Wallace, “Enabling empathy in health and care: design methods and challenges,” CHI’14 Ext. …, pp. 139–142, 2014. \ 19. A. Culén and M. Van Der Velden, “The Digital Life of Vulnerable Users: Designing with Children, Patients, and Elderly,” Nord. Contrib. IS Res., pp. 53–71, 2013. \ 20. B. Friedman, P. H. Kahn Jr, and A. Borning, Early engagement and new technologies: Opening up the laboratory, vol. 16. Dordrecht: Springer Netherlands, 2013, pp. 57–95. \ 21. D. Henderson Jr, “The Trillium user interface design environment,” ACM SIGCHI Bull., no. April, pp. 221–227, 1986. \ 22. J. Kim, “Taos Pueblo and a Thousand Year Old Adobe Architecture - New Mexico,” 2012. [Online]. Available: http://runawayjuno.com/runawaymedia/photo-of-the-week/taos-pueblo-adobearchitecture-new-mexico/. [Accessed: 29-Sep2014]. \ 23. Indian Summer Native American Art, 2013. [Online]. Available: http://indiansummerart.blogspot.com/2013/02/nat ive-american-dances-feasts-markets.html. [Accessed: 29-Sep-2014]. \ ","STEM; Native American; Pueblo Schools; Peer Learning Communities; Communities of Practice; K-12 Education","H.3 ","case0128-file1.docx","","","case0128-file4.mp4","","","Indigenous knowledge is an integral part of learning. Our work explores collaborative technologies for building online Native American teacher communities to bridge the gap between formal and indigenous education.","","early release","FinalAccept","","National Science Foundation","DGE 1144083","University of Colorado Boulder","","Los Alamos National Laboratory","","Jan 13 13:18",""
