"case137","A","BodyGuard: A Case Study of Telecare Product Innovation and Development","Andrea","Taylor","A.Taylor@gsa.ac.uk","case0137-paper.pdf","8","letter","","","Andrea Taylor, Lorna Bernard, Hugh Pizey, Craig Whittet, Samantha Davies, David Hammond, Julian Edge","A.Taylor@gsa.ac.uk, Lorna.Bernard@moray.gov.uk, H.Pizey@gsa.ac.uk, C.Whittet@gsa.ac.uk, Samantha.Davies@chubb.co.uk, David.Hammond@chubb.co.uk, Julian.Edge@chubb.co.uk","12663","Andrea","","Taylor","A.Taylor@gsa.ac.uk","","Glasgow School of Art","Glasgow","","United Kingdom","","","","","","47638","Lorna","","Bernard","Lorna.Bernard@moray.gov.uk","","Moray Community Health and Social Care Partnership","Elgin","","United Kingdom","","","","","","47639","Hugh","","Pizey","H.Pizey@gsa.ac.uk","","Glasgow School of Art","Glasgow","","United Kingdom","","","","","","47640","Craig","","Whittet","C.Whittet@gsa.ac.uk","","Glasgow School of Art","Glasgow","","United Kingdom","","","","","","47641","Samantha","","Davies","Samantha.Davies@chubb.co.uk","","Chubb Community Care","Lancashire","","United Kingdom","","","","","","47642","David","","Hammond","David.Hammond@chubb.co.uk","","Chubb Community Care","Lancashire","","United Kingdom","","","","","","47643","Julian","","Edge","Julian.Edge@chubb.co.uk","","Chubb Community Care","Lancashire","","United Kingdom","","","","","","","","","","","","","","","","","","","","","","","","","","","","","","","","","","","","","","","","","","","","","","","","","","","Andrea Taylor","A.Taylor@gsa.ac.uk","Telecare is personal and environmental sensors that support people to remain safe and independent in their own home for longer. Telecare plays an important role in addressing the challenges of an ageing population. However, many people do not wear the most common form provided, the community alarm, for reasons that include the way that it looks. In the UK, a contributing factor to this problem is that manufacturers cater to telecare service providers (e.g. local authorities) and as a result, service users are not involved in design processes. This paper describes a redesign of the community alarm by a leading manufacturer, involving participatory design activities with users and the wider public, and design internships. The main innovation of the new community alarm, called BodyGuard, is that it connects with the user’s smartphone to enable it to work outside the home. We report insights and lessons learned during the innovation process, within the context of social care reforms giving people more control and choice over the services that they receive.","1. A National Telehealth and Telecare Delivery Plan for Scotland to 2015: Driving Improvement, Integration and Innovation. http://www.scotland.gov.uk/Publications/2012/12/7791/0 \ 2. Blythe, M.A., Monk, A.F., and Doughty, K. Socially dependable design: the challenge of ageing populations for HCI. Interacting With Computers 17, 6 (2005), 678-679. \ 3. Chubb Community Care. http://www.chubbcommunitycare.co.uk \ 4. Davies, K. The views of elderly people on emergency alarm use. Clin Rehabil 7, 4 (1993), 278-282. \ 5. ICT & Aging. http://www.ict-ageing.eu/ict-ageingwebsite/wp-content/uploads/2010/D18_final_report.pdf \ 6. Lifestyles in Later Life: Identity, Choice and Stigma. http://circle.leeds.ac.uk/files/2014/04/AKTIVEPaper-5.pdf \ 7. Living it Up. https://portal.livingitup.org.uk \ 8. Muller, M.J. Participatory design: the third space in HCI. L. Erlbaum Associates Inc., Hillsdale, NJ, USA, 2002. \ 9. Nike+ FuelBand. http://www.nike.com/us/en_us/c/nikeplus-fuelband \ 10. Pullin, G. Design Meets Disability. Cambridge: The MIT Press, 2009. \ 11. Sebastian Conran Associates. http://sebastianconran.com/project-66 \ 12. Self Directed Support Scotland. http://www.selfdirectedsupportscotland.org.uk \ 13. Sjölinder, M., and Avatare Nöu, A. Indoor and Outdoor Social Alarms: Understanding Users' Perspectives. JMIR Mhealth Uhealth 2(1):e9 (2014). \ 14. Taylor, A., and Agamanolis, S. Evaluation of the User Experience of a Standard Telecare Product – The Personal Trigger. In Proc. eTELEMED 2010, IEEE (2010), 51-56. \ 15. Taylor, A., Bernard, L., Pizey, H., and Whittet, C. TeleWEAR: engaging users and suppliers of telecare in product design. Ext. Abstracts CHI 2012, ACM Press (2012), 2637-2642. \ 16. The Communications Market Report: United Kingdom. http://stakeholders.ofcom.org.uk/marketdata-research/market-data/communications-marketreports/cmr14/uk/ \ 17. UP by Jawbone. https://jawbone.com/up \ ","Assistive technology; community alarm; community alarm service; participatory design; social care; telecare","H.5.m","case0137-file1.doc","","","","","","Describes the innovation of the telecare community alarm, involving collaboration between academia and industry, participatory design activities with users and the wider public, and design internships.","","early release","FinalAccept","","","","","","","","Jan  7 09:45",""
"case138","A","Representation Strategies Adopted by Participants in a Population Stereotype Hunt: A Case Study for Icon Design","Avijit","Sengupta","avijit79@gmail.com","case0138-paper.pdf","6","letter","","","Avijit Sengupta, Klarissa T.T. Chang, Maffee Peng-Hui Wan, Wen Yong Chua","avijit79@gmail.com, changtt@comp.nus.edu.sg, diswp@nus.edu.sg, wenyong@comp.nus.edu.sg","29809","Avijit","","Sengupta","avijit79@gmail.com","Department of Information Systems, National University of Singapore","Singapore","Singapore","Singapore","Singapore","","","","","","29808","Klarissa","T.T.","Chang","changtt@comp.nus.edu.sg","Department of Information Systems","National University of SIngapore","Singapore","Singapore","Singapore","","","","","","29767","Maffee Peng-Hui","","Wan","diswp@nus.edu.sg","Information Systems","National University of Singapore","Singapore","","Singapore","","","","","","39760","Wen Yong","","Chua","wenyong@comp.nus.edu.sg","Information Systems","National University of Singapore","Singapore","","Singapore","","","","","","","","","","","","","","","","","","","","","","","","","","","","","","","","","","","","","","","","","","","","","","","","","","","","","","","","","","","","","","","","","","","","","","","","","","","","","","","","","","","","","","","","","","","","","","","","Avijit Sengupta","avijit79@gmail.com","Population Stereotype tells interaction designers just one-half of the complete story. It informs them only about the level of general consensus regarding each representation generated by different participants. It does not provide answers to those questions, which ask how the representation is to be achieved. Identification of different representation strategies adopted by different participants can reveal the rest of the story. In the presence of more than one or no strong contenders (population stereotype), adoption of the right representation strategy can be really beneficial. As most of the representational strategies are complementary to each other, the combination of different representational strategies can lead towards a more representative icon development.","WARNING: Reference 4 is very long.  Please check it. \  \ 1. Jones, S. Stereotypy in pictograms of abstract concepts. Ergonomics 26, (1983), 605-611. \ 2. Nakamura, C. and Treitler, Z. Q. A taxonomy of representation strategies in iconic communication. Int. Journal of Human Computer Studies 70, 8 (2012), 535551. \ 3. Paivio, A. Imagery and Verbal Processes. East Bourne: Holt, Rinehart & Winston. (1971). \ 4. Rogers, Y. and Oborne, D. J. Pictorial communication of abstract verbs in relation to humancomputer interaction. British Journal of psychology 78, (1987) 99-112.  \ ","Population stereotype; representation strategies; icon","H.5.2; I.3.6","case0138-file1.doc","","","","","","Identification of different representation strategies adopted by different participants can reveal an effective and complementary method for designing icons. Know ‘how’ (which strategy to use) along with ‘what’ (representation).","","early release","FinalAccept","","","","","","","","Jan 14 08:37",""
"case139","A","Can Androids Be Salespeople in the Real World?","Miki","Watanabe","watanabe.miki@irl.sys.es.osaka-u.ac.jp","case0139-paper.pdf","8","letter","","","Miki Watanabe, Kohei Ogawa, Hiroshi Ishiguro","watanabe.miki@irl.sys.es.osaka-u.ac.jp, k.ogawa@gmail.com, ishiguro@sys.es.osaka-u.ac.jp","45551","Miki","","Watanabe","watanabe.miki@irl.sys.es.osaka-u.ac.jp","Engineering Science/Osaka University/Ishiguro laboratory","Osaka University","Toyonaka","Osaka","Japan","","","","","","9534","Kohei","","Ogawa","k.ogawa@gmail.com","Engineering Science/Osaka University/Ishiguro laboratory","Osaka University","Toyonaka","Osaka","Japan","","","","","","29258","Hiroshi","","Ishiguro","ishiguro@sys.es.osaka-u.ac.jp","Engineering Science/Osaka University/Ishiguro Lab","Osaka University","Toyonaka","Osaka","Japan","","","","","","","","","","","","","","","","","","","","","","","","","","","","","","","","","","","","","","","","","","","","","","","","","","","","","","","","","","","","","","","","","","","","","","","","","","","","","","","","","","","","","","","","","","","","","","","","","","","","","","","","","","","","","","","Miki Watanabe","watanabe.miki@irl.sys.es.osaka-u.ac.jp","The roles of robots in the real world have become more diverse depending on their bodily properties. In this study, we aim to determine the roles that androids, whose bodily properties resemble humans, could serve in the real world.  \ Selling and purchasing are common human activities. Therefore, we proposed the use of an android as a salesperson with cognitive and affective strategies utilizing the advantages of online- and counter- selling methods. We conducted a field study to investigate whether androids could sell goods in a department store. As a result, our sales strategies worked well and the android could sell 43 sweaters that cost approximately 100 dollars each for 10 days. These results are important knowledge for determining how androids may serve new roles and communicate with humans in the real world.","1. Kanda, T., Shiomi, M., Miyashita, Z., Ishiguro, H., Hagita, N.: An aﬀective guide robot in a shopping mall; In Proceedings of the 4th ACM/IEEE international conference on Human robot interaction (2009), 173-180. \ 2. Shiomi, M., Shinozawa, K., Nakagawa, Y., Miyashita, T., Sakamoto, T., Terakubo, T., Hagita, N: Recommendation eﬀects of a social robot for advertisement-use context in a shopping mall; International Journal of Social Robotics (2013), 251-262. \ 3. Wada, K., Shibata, T: Robot therapy in a care house-its sociopsychological and physiological eﬀects on the residents. In Robotics and Automation, 2006. ICRA 2006. Proceedings 2006 IEEE International Conference on (2006), 3966-3971. \ 4. S. Nishio, H. Ishiguro, and N. Hagita: Geminoid: Teleoperated android of an existing person; Chapter in Humanoid Robots: New Developments, I-Tech Education and Publishing, Vienna, Austria (2007) 343-352. \ 5. Watanabe, M., Ogawa, K., Ishiguro, H: Field study: can androids be a social entity in the real world?. In Proceedings of the 2014 ACM/IEEE international conference on Human-robot interaction (2014), 316-317. \ 6. Rintamaki, T., Kanto, A., Kuusela, H., Spence, M. T: Decomposing the value of department store shopping into utilitarian, hedonic and social dimensions: evidence from Finland. International Journal of Retail and Distribution Management (2006), 6-24. \ 7. Limayem, M., Khalifa, M., Frini, A: What makes consumers buy from Internet? A longitudinal study of online shopping. Systems, Man and Cybernetics, Part A: Systems and Humans, IEEE Transactions on (2000), 421-432. \ 8. Sekozawa, T: Recommendation system for apparel online shopping. WSEAS TRANSACTIONS on SYSTEMS (2010), 488-497. \ 9. Ward, M. R: Will online shopping compete more with traditional retailing or catalog shopping?. Netnomics (2001), 103-117. \ 10. Petty, R. E., Cacioppo, J. T: The elaboration likelihood model of persuasion. Advances in experimental social psychology (1986), 123-205. \ 11. McLuhan, M., Fiore, Q: The medium is the message; New York, (1967) \ ","android robot; field study; sales; conversation; affection; human robot interaction","H.4.3","case0139-file1.zip","","","","","","Development of androids, human-like appearance robots, that sell clothes in a department store.","I changed the references part. I deleted a Fogg's paper because I did not mention it in my paper.","early release","FinalAccept","","","","","","","","Jan  8 20:42",""
"case140","A","An Outlook for Content UX in TV: The Emergence of Augmented Content","Sung Woo","Kim","caerang@gmail.com","case0140-paper.pdf","8","letter","","","Sung Woo Kim, Eun Hye Park, Yae Eun Lee, Jong Sung Lee, Da Hee Lee, Eun Jin Kim","caerang@kookmin.ac.kr, eunhye7070@gmail.com, yenn2201@gmail.com, jslee0587@gmail.com, yd4429@gmail.com, kej85823@gmail.com","45982","Sung Woo","","Kim","caerang@kookmin.ac.kr","Graduate School of Techno Design","Kookmin University","Seoul","","Republic of Korea ","","","","","","47676","Eun Hye","","Park","eunhye7070@gmail.com","Graduate School of Techno Design","Kookmin University","Seoul","","Korea, Republic of","","","","","","47677","Yae Eun","","Lee","yenn2201@gmail.com","Graduate School of Techno Design","Kookmin University","Seoul","","Korea, Republic of","","","","","","47678","Jong Sung","","Lee","jslee0587@gmail.com","Graduate School of Techno Design","Kookmin University","Seoul","","Korea, Republic of","","","","","","47679","Da Hee","","Lee","yd4429@gmail.com","Graduate School of Techno Design","Kookmin University","Seoul","","Korea, Republic of","","","","","","47680","Eun Jin","","Kim","kej85823@gmail.com","Graduate School of Techno Design","Kookmin University","Seoul","","Korea, Republic of","","","","","","","","","","","","","","","","","","","","","","","","","","","","","","","","","","","","","","","","","","","","","","","","","","","","","","","","","","","","","","","","","","Sung Woo Kim","caerang@gmail.com","This case study describes the findings from our exploration on content user experience for next- generation live TV and VOD (Video-on-Demand) services. First, we introduce our background study on new trends in the TV industry. Based on this study, we list several keywords that characterize the content experience for next-generation TV. We then describe our interviews with six professionals working in content production. These interviews were conducted to verify our derived characteristics, and to collect the thoughts of these experts on the contribution of UX to future content production. Our study led us to a new research topic we call “Augmented Content,” which we believe has significant potential to provide content UX for next- generation television services.","1. Bailly, B. Future of Entertainment: Introduction to Socially Curated Discovery. July 15, 2013. http://iq.intel.com/future-of-entertainmentintroduction-to-socially-curated-discovery/ \ 2. Interview with Ed White, Contagious: What is Augmented Content? http://www.youtube.com/watch?v=swf82-t3n4o \ 3. The New Multi-screen World: understanding Crossplatform Consumer Behavior. http://think.withgoogle.com/databoard/media/pdfs/the -new-multi-screen-world-study_research-studies.pdf \ 4. Satell, G. What Netflix’s ‘House of Cards’ Means for The Future of TV. Forbes March 4, 2013. http://www.forbes.com/sites/gregsatell/2013/03/04/wh at-netflixs-house-of-cards-means-for-the-future-of-tv/ \ 5. Vinayagamoorthy, V., Allen, P., Hammond, M., & Evans, M. (2012, May). Researching the user experience for connected tv: a case study. In CHI'12 Extended Abstracts on Human Factors in Computing Systems (pp. 589-604). ACM. \ ","TV; Content UX; Multi Source Multi Use","H.5.m","case0140-file1.doc","","","","","","Our case study introduces a new research topic of “Augmented Content,” which we believe has significant potential to provide content UX for next- generation television services.","","","FinalAccept","","","","","","","","Jan 14 08:45",""
"case147","A","TRANSFORM: Embodiment of “Radical Atoms” at Milano Design Week","Philipp","Schoessler","phil_s@media.mit.edu","case0147-paper.pdf","8","letter","","","Hiroshi Ishii, Daniel Leithinger, Sean Follmer, Amit Zoran, Philipp Schoessler, Jared Counts","ishii@media.mit.edu, daniell@media.mit.edu, sfollmer@media.mit.edu, amitz@media.mit.edu, phil_s@media.mit.edu, jcounts@mit.edu","2008","Hiroshi","","Ishii","ishii@media.mit.edu","","MIT Media Lab","Cambridge","Massachusetts","United States","","","","","","16013","Daniel","","Leithinger","daniell@media.mit.edu","MIT Media Lab, MIT, Cambridge, Massachusetts, United States","","","","","","","","","","15323","Sean","","Follmer","sfollmer@media.mit.edu","","MIT Media Lab, Cambridge","Cambridge","Massachusetts","United States","","","","","","11607","Amit","","Zoran","amitz@media.mit.edu","MIT Media Lab","MIT","Cambridge","Massachusetts","United States","","","","","","39102","Philipp","","Schoessler","phil_s@media.mit.edu","","MIT Media Lab","Cambridge","Massachusetts","United States","","","","","","47735","Jared","","Counts","jcounts@mit.edu","MIT Media Lab","MIT","Cambridge","Massachusetts","United States","","","","","","","","","","","","","","","","","","","","","","","","","","","","","","","","","","","","","","","","","","","","","","","","","","","","","","","","","","","","","","","","","","Philipp Schoessler","phil_s@mit.edu","RANSFORM fuses technology and design to celebrate the transformation from a piece of static furniture to a dynamic machine driven by streams of data and energy. TRANSFORM aims to inspire viewers with unexpected transformations, as well as the aesthetics of a complex machine in motion. This paper describes the concept, engine, product, and motion design of TRANSFORM, which was first exhibited at LEXUS DESIGN AMAZING 2014 MILAN in April 2014.","1. S. Follmer, D. Leithinger, A. Olwal, A. Hogge, and H. Ishii. 2013. inFORM: dynamic physical affordances and constraints through shape and object actuation. In Proc. of UIST '13. ACM, New York, NY, USA, 417-426 \ 2. H. Ishii, et. al. TRANSFORM (April 2014), http://tangible.media.mit.edu/project/transform/ \ 3. H. Ishii, D. Lakatos, L. Bonanni, and J. Labrune. 2012. Radical atoms: beyond tangible bits, toward transformable materials. interactions 19, 1 (January 2012), 38-51 \ 4. H. Ishii, C. Ratti, B. Piper, Y. Wang, A. Biderman, and E. Ben-Joseph. 2004. Bringing Clay and Sand into Digital Design — Continuous Tangible user Interfaces. BT Technology Journal 22, 4 (October 2004), 287-299 \ 5. H. Ishii and B. Ullmer. 1997. Tangible bits: towards seamless interfaces between people, bits and atoms. In Proc. of CHI '97. ACM, New York, NY, USA, 234-241 \ 6. D. Leithinger, S. Follmer, A. Olwal, and H. Ishii. 2014. Physical telepresence: shape capture and display for embodied, computer-mediated remote collaboration. In Proc. of UIST '14. ACM, New York, NY, USA, 461-470 \ 7. Lexus International (April 2014), http://www.lexus-int.com/design-events/2014.html \ 8. Lexus International, Lfinesse, http://www.lexus-int.com/design/l-finesse.html Figure 11. Impressions of visitors experiencing TRANSFORM in Milano \ ","Tangible User Interfaces; Radical Atoms; Shape Display; Shape Changing Interfaces; Design","H.5.2","case0147-file1.docx","case0147-file2.jpg","","case0147-file4.mp4","TRANSFORM fuses technology and design to celebrate the transformation from a piece of static furniture to a dynamic machine driven by streams of data and energy.","","This paper describes the concept, engine, product, and motion design of TRANSFORM, which was first exhibited at LEXUS DESIGN AMAZING 2014 MILAN in April 2014.","","early release","FinalAccept","","","","","","","","Jan  9 11:08",""
"case153","A","When Value is Greater than Money: a Micropayment System in Uganda","Jeni","Paay","jeni@cs.aau.dk","case0153-paper.pdf","8","letter","","","Rasmus Prentow, Rasmus Steiniche, Simone D Johansen, Jeni Paay, Ivan Aaen, Jesper Kjeldskov","rprentow@gmail.com, rs@pay-e-safe.com, sdj@pay-e-safe.com, jeni@cs.aau.dk, ivan@cs.aau.dk, jesper@cs.aau.dk","47761","Rasmus","","Prentow","rprentow@gmail.com","Computer Science","Aalborg University","Aalborg East","","Denmark","","","","","","47762","Rasmus","","Steiniche","rs@pay-e-safe.com","Computer Science","Aalborg University","Aalborg East","","Denmark","","","","","","47763","Simone","D","Johansen","sdj@pay-e-safe.com","Electronic Systems","aalborg University","aalborg East","","Denmark","","","","","","10250","Jeni","","Paay","jeni@cs.aau.dk","","Aalborg University","Aalborg","","Denmark","","","","","","47764","Ivan","","Aaen","ivan@cs.aau.dk","Computer Science","Aalborg University","Aalborg East","","Denmark","","","","","","1622","Jesper","","Kjeldskov","jesper@cs.aau.dk","","Aalborg University","Aalborg","","Denmark","","","","","","","","","","","","","","","","","","","","","","","","","","","","","","","","","","","","","","","","","","","","","","","","","","","","","","","","","","","","","","","","","","Jeni Paay","jeni@cs.aau.dk","The Pay-E-Safe system is a token-based car battery powered electronic micropayment system for emerging markets in East Africa. This is the story of how it was developed with different ethnic groups in Kasese, Uganda, combining methods from HCI, software development, and business modeling. We created a system that is inexpensive to implement, sensitive to the Ugandan context (e.g. low incomes, unreliable power supplies and unstable Internet connections) and provides benefits to local vendors as well as added value to users and their families. Using observations, interviews and prototype evaluations with local Ugandans we studied people’s spending behaviors and then explored alternative design solutions with them. Along the way, we discovered that a micropayment system could actually add value to the user experience beyond the exchange of money for services. This case study reports on how we designed the system and the additional value it afforded users.","1. Aaen, I. Essence: Facilitating software innovation. European Journal of IS, 15, 5 (2008), 543-553. \ 2. Centre for Disease Control and Protection. Ebola. http://www.cdc.gov/vhf/ebola/outbreaks/2014-westafrica/index.html \ 3. CIA. The world factbook - Uganda, 2013. https://www.cia.gov/library/publications/the-worldfactbook/geos/ug.html \ 4. Dell, N., Vaidyanathan, V., Mehdi, I., Cutrell, E. and Theis, W. ""Yours is better!"": participant response bias in HCI. Proc. CHI 2012, ACM Press (2012), 1321-1330. \ 5. Fogstede Centre, National Cultural Dimensions, http://geert-hofstede.com/national-culture.html \ 6. Gallup World Survey. Few in Sub-Saharan Africa Have Money in a Bank. http://www.gallup.com/poll/ 127901/few-sub-saharan-africa-money-bank.aspx \ 7. MTN. Mobile Money Rates http://www.mtn.co.ug/MTN-Services/MobileBanking/MTN-MobileMoney-Rates.aspx \ 8. Osterwalder, A. and Pigneur, Y. Business Model Generation: A Handbook for Visionaries, Game Changers, and Challengers. Wiley, 2010. \ 9. Rogers, Y., Sharp, H., and Preece, J. Interaction Design. Wiley, 2011. \ 10. Schön, D. The Reflective Practitioner: How professionals think in action. Basic Books, 1983. \ 11. Schutz, A. and Wagner, H. Alfred Schutz on Phenomenology and Social Relations. Heritage of Sociology Series, University of Chicago Press, 1970. \ 12. Standard Chartered Bank Uganda. Personal Banking. https://www.sc.com/ug/personalbanking/deposits/current-account/en/. \ 13. Udenrigsministeriet. Landefakta (Uganda) 2012. http://Uganda.um.dk/da/om-uganda/landefakta/. \ 14. Uganda Bureau of Statistics. Country reports on human rights practices for 2012 Uganda 2009/10. http://www.ubos.org/onlinefiles/uploads/ubos/sdds/UB OS%20-%20GDDS_SDDS.htm. \ 15. WHO. Sanitation: Controlling problems at source. http://www.who.int/water_sanitation_health/sanitprobl ems/en/. \ ","Qualitative research; field studies; prototyping; developing countries; electronic payment system.","H.5.m","case0153-file1.docx","","","","","","We created a system that is inexpensive to implement, sensitive to the Ugandan context and provides benefits to local vendors as well as added value to users and their families.","","","FinalAccept","","","","","","","","Jan  7 07:31",""
