"case155","A","A consensual and non-ambiguous set of gestures to interact with UAV in infantrymen","Florent","TARALLE","florent.taralle@mines-paristech.fr","case0155-paper.pdf","7","letter","","","Florent Taralle, Alexis Paljic, Sotiris Manitsaris, Jordane Grenier, Christophe Guettier","florent.taralle@mines-paristech.fr, alexis.paljic@mines-paristech.fr, sotiris.manitsaris@mines-paristech.fr, jordane.grenier@sagem.com, christophe.guettier@sagem.com","47765","Florent","","Taralle","florent.taralle@mines-paristech.fr","Sagem Defense et Sécurité","Sagem Defense et Sécurité","Massy","","France","MINES-Paristech","MINES-Paristech","Paris","","France","32201","Alexis","","Paljic","alexis.paljic@mines-paristech.fr","CAOR","Mines ParisTech","Paris","","France","","","","","","34795","Sotiris","","Manitsaris","sotiris.manitsaris@mines-paristech.fr","Mathématiques et Systèmes/MINES ParisTech/Robotics Lab","Ecole Nationale Supérieure des Mines de Paris","Paris","Ile de France","France","","","","","","47884","Jordane","","Grenier","jordane.grenier@sagem.com","","Sagem Défense et Sécurité","Massy","","France","","","","","","47885","Christophe","","Guettier","christophe.guettier@sagem.com","R&T Directorate","Sagem Défense et Sécurité","Massy","","France","","","","","","","","","","","","","","","","","","","","","","","","","","","","","","","","","","","","","","","","","","","","","","","","","","","","","","","","","","","","","","","","","","","","","","","","","","","","","","","","","Florent TARALLE","florent.taralle@mines-paristech.fr","In the context of using an Unmanned Aerial Vehicle (UAV) in hostile environments, gestures allow to free the operator of bulky control interfaces. Since a navigation plan is defined before the mission, only a few commands have to be activated during the mission. This allows a gestural symbolic interaction that maps commands to a set of gestures. Nevertheless, as gestures are not universal, this asks the question of choosing the proper gestures that are easy to learn memorize and perform. We propose a four step methodology for eliciting a gestural vocabulary, and apply it to this use case. The methodology consists of 4 steps: (1) collecting gestures through user creativity sessions, (2) extracting candidate gestures to build a catalogue, (3) electing the gesture vocabulary and (3) evaluating the non-ambiguity of it. We then discuss the relevance of the GV.","1. Archer, D. (1997). Unspoken diversity: Cultural differences in gestures. Qualitative Sociology, 20(1), 79-105. \ 2. Calbris, G. (1990). The semiotics of French gestures (Vol. 1900) \ 3. Choi, E., Kwon, S., Lee, D., Lee, H., & Chung, M. K. (2012). Can user-derived gesture be considered as the best gesture for a command?: Focusing on the commands for smart home system. In Proc. of the Human Factors and Ergonomics Society Annual Meeting (Vol. 56, No. 1, pp. 1253-1257) \ 4. Coutaz, J. (1996). L'art de communiquer à plusieurs voies. La Recherche, (285), 38-43. \ 5. Kendon, A. (1996). An agenda for gesture studies. Semiotic review of books, 7(3), 8-12. \ 6. McNeill, D. (1985). So you think gestures are nonverbal?. Psychological review, 92(3), 350. \ 7. Ng, W. S., & Sharlin, E. (2011). Collocated interaction with flying robots. In RO-MAN (pp. 143-149) \ 8. Nielsen, M., Störring, M., Moeslund, T. B., & Granum, E. (2004). A procedure for developing intuitive and ergonomic gesture interfaces for HCI. In GestureBased Communication in Human-Computer Interaction (pp. 409-420) \ 9. Pfeil, K., Koh, S. L., & LaViola, J. (2013). Exploring 3d gesture metaphors for interaction with unmanned aerial vehicles. In Proc. of the international conference on Intelligent user interfaces (pp. 257-266) \ 10. Stern, H. I., Wachs, J. P., & Edan, Y. (2004). Hand gesture vocabulary design: a multicriteria optimization. In Systems, Man and Cybernetics \ 11. Stern, H. I., Wachs, J. P., & Edan, Y. (2006). Optimal hand gesture vocabulary design using psychophysiological and technical factors. In Automatic Face and Gesture Recognition, 2006. 7th International Conference on (pp. 257-262) \ 12. Stern, H. I., Wachs, J. P., & Edan, Y. (2008). Optimal consensus intuitive hand gesture vocabulary design. In Semantic Computing, 2008 IEEE International Conference on (pp. 96-103) \ 13. Wachs, J. (2006). Optimal hand gesture vocabulary design methodology for virtual robotic control (Doctoral dissertation, Ben-Gurion University of the Negev). \ 14. Wobbrock, J. O., Aung, H. H., Rothrock, B., & Myers, B. A. (2005). Maximizing the guessability of symbolic input. In CHI'05 extended abstracts on Human Factors in Computing Systems (pp. 1869-1872) \ 15. Wobbrock, J. O., Morris, M. R., & Wilson, A. D. (2009). User-defined gestures for surface computing. In Proc. of the SIGCHI Conference on Human Factors in Computing Systems (pp. 1083-1092) \ ","","H.1.2","case0155-file1.docx","","","","","","A four steps methodology for eliciting a gestural vocabulary is presented. This method is applied to the specific use case of choosing gestures to command a UAV for infantrimen.","","","FinalAccept","","","","","","","","Jan 13 05:41",""
"case156","A","Volvo Single View of Vehicle: Building a Big Data Service from Scratch in the Automotive Industry","Paweł","Woźniak","pawelw@chalmers.se","case0156-paper.pdf","8","letter","","","Paweł Woźniak, Robert Valton, Morten Fjeld","pawelw@chalmers.se, robert.valton@volvo.com, fjeld@chalmers.se","31311","Paweł","","Woźniak","pawelw@chalmers.se","t2i Interaction Laboratory","Chalmers University of Technology","Gothenburg","","Sweden","","","","","","47781","Robert","","Valton","robert.valton@volvo.com","","Volvo Group Telematics","Gothenburg","","Sweden","","","","","","3938","Morten","","Fjeld","fjeld@chalmers.se","t2i Lab","Chalmers University of Technology","Gothenburg","","Sweden","","","","","","","","","","","","","","","","","","","","","","","","","","","","","","","","","","","","","","","","","","","","","","","","","","","","","","","","","","","","","","","","","","","","","","","","","","","","","","","","","","","","","","","","","","","","","","","","","","","","","","","","","","","","","","","Paweł Woźniak","pawelw@chalmers.se","Big data analytics is a major trend affecting business today. Many organizations collect vast amounts of data simply to investigate if its market value can be identified. In this case study, we contribute a practical example of using the big data approach to create innovative services. We describe our work to identify and integrate data sources in order establish what data is available and who may benefit from it. We then show how we worked with users to communicate the vast possibilities created when many data sources are integrated, and participated in building a new big data service. Finally, we share a set of lessons we learned which can guide future big data inquiries. Our work was conducted in the context of the inspection, service, and sale of Volvo trucks, significantly aiding risk management for Volvo Used Trucks EMEA.","1. Churchill, E. F. From data divination to data-aware design. interactions 19, 5 (Sept. 2012), 10–13. \ 2. Fisher, D., DeLine, R., Czerwinski, M., and Drucker, S. Interactions with big data analytics. interactions 19, 3 (May 2012), 50–59. \ 3. Jacobs, A. The pathologies of big data. Commun. ACM 52, 8 (Aug. 2009), 36–44. \ 4. Kim, J., Lund, A., and Dombrowski, C. Telling the story in big data. interactions 20, 3 (May 2013), 48–51. \ 5. Lehikoinen, J., and Koistinen, V. In big data we trust? interactions 21, 5 (Sept. 2014), 38–41. \ 6. Preece, J., Rogers, Y., and Sharp, H. Interaction Design, 1st ed. John Wiley & Sons, Inc., New York, NY, USA, 2002. \ 7. The New York Times. The age of big data. 2012-10-02. http://www.nytimes.com/2012/02/12/sundayreview/big-datas-impact-in-the-world.html. \ ","Big data; user experience; data-centred services; data warehousing; case studies; service innovation; data analytics; business insights; telematics","H.5.2","case0156-file1.tex","case0156-file2.jpg","","","Low-fidelity prototyping for provoking users to reflect on big data.","","We contribute a practical example of using the big data approach to create services in the automotive domain by building a truck price estimation tool.","","","FinalAccept","","Research Executive Agency","290227","","","","","Jan 14 09:19",""
"case163","A","Moving on its Own: How do Audience Interacts with an Autonomous Moving Artwork","Florent","Levillain","flevillain@mac.com","case0163-paper.pdf","8","letter","","","Florent Levillain, Sébastien Lefort, Elisabetta Zibetti","flevillain@mac.com, sebastien.lefort@lip6.fr, ezibetti@univ-paris8.fr","47792","Florent","","Levillain","flevillain@mac.com","CHART-LUTIN EA 4004","Université Paris 8","Paris","","France","","","","","","47822","Sébastien","","Lefort","sebastien.lefort@lip6.fr","create","Université Paris 6","Paris","","France","","","","","","47823","Elisabetta","","Zibetti","ezibetti@univ-paris8.fr","create","Université Paris 8","Paris","","France","","","","","","","","","","","","","","","","","","","","","","","","","","","","","","","","","","","","","","","","","","","","","","","","","","","","","","","","","","","","","","","","","","","","","","","","","","","","","","","","","","","","","","","","","","","","","","","","","","","","","","","","","","","","","","","Florent Levillain","flevillain@mac.com","In contemporary art, a new type of artworks use motion as a material from which to create the illusion of life. These autonomous robotic artworks have a behavioral specificity; they tend to be perceived as living, and by some account intentional entities. To account for this behavioral specifity and how it affects the audience experience, we propose a data-driven approach to reveal specific visit patterns. Through a cluster analysis performed on visitors’ path inside an installation involving autonomous objects, we highlight four different attitudes characterized by patterns of approach or withdrawal, passive observation and exploration. ","1. Cornock, S., & Edmonds, E. (1973). The creative process where the artist is amplified or superseded by the computer. Leonardo, 11-16. \ 2. Rutherford, M.D., & Kuhlmeier, V.A. (2013). Section introduction: The perception of animacy and intentional behavior. In M.D. Rutherford & V.A. Kuhlmeier (Eds) Social Perception. MIT Press. \ 3. Höök, K., Sengers, P., & Andersson, G. (2003, April). Sense and sensibility: evaluation and interactive art. In Proceedings of the SIGCHI conference on Human factors in computing systems (pp. 241-248). ACM. \ 4. Costello, B., & Edmonds, E. (2007) A study in play, pleasure and interaction design. In Proceedings of the 2007 conference on Designing pleasurable products and interfaces (pp. 76-91). ACM. \ 5. Bilda, Z., Muller, L., & Edmonds, E. (2009). Artist, evaluator and curator: three viewpoints on interactive art, evaluation and audience experience. Digital Creativity, 20(3), 141-151. \ 6. Loke, L., & Robertson, T. (2009). Design representations of moving bodies for interactive, motion-sensing spaces. Int.J.Human-Computer Studies, 67, 394-410. \ 7. Boehner, K., Thom-Santelli, J., Zoss, A., Gay, G., Hall, J. S., & Barrett, T. (2005, April). Imprints of place: creative expressions of the museum experience. In CHI'05 extended abstracts on Human factors in computing systems (pp. 1220-1223). ACM. \ 8. Edmonds, E., Muller, L., & Connell, M. (2006). On creative engagement. Visual Communication, 5(3), 307-322. \ 9. Saerbeck, M., & Bartneck, C. (2010). Attribution of affect to robot motion. Proceedings of the 5th ACM/IEEE International Conference on Human-Robot Interaction, Osaka pp. 53-60. \ 10. Bilda, Z (2006) Evaluating audience experience Engage: interaction, art and audience experience. Creativity and Cognition Studios Press, Australia 248- \ 11. Candy, L, Amitani, S and Bilda, Z (2006) Practiceled strategies for interactive art research, CoDesign: International Journal of Co Creation in Design and the Arts Vol 3 pp 209e223 \ 12. Tractinsky, N., Katz, A. S., & Ikar, D. (2000). What is beautiful is usable. Interacting with computers, 13(2), 127-145. \ 13. Hassenzahl, M. (2004). The interplay of beauty, goodness, and usability in interactive products. HumanComputer Interaction, 19(4), 319-349. \ 14. Vom Lehn, D., Heath, C., & Hindmarsh, J. (2001). Exhibiting interaction: Conduct and collaboration in museums and galleries. Symbolic Interaction, 24(2), 189-216. \ 15. Costello, B., Muller, L., Amitani, S., Edmonds, E. (2000). Understanding the experience of interactive art: iamascope in beta_space. In Pisan, Y. (Ed.), Australasian Conference on Interactive Entertainment. Creativity and Cognition Studio Press, pp. 49-56. \ 16. Krishnapuram, R., Joshi, A., & Yi, L. (1999, August). A fuzzy relative of the k-medoids algorithm with application to web document and snippet clustering. In Fuzzy Systems Conference Proceedings, 1999. FUZZ-IEEE'99. 1999 IEEE International (Vol. 3, pp. 1281-1286). IEEE. \ 17. Thorndike, R. L. (1953). Who belongs in the family? Psychometrika, 18(4), 267-276. \ ","audience experience; interactive arts; behavioral artworks; engagement; cluster analysis","I.2.9; J.4; J.5","case0163-file1.doc","","","","","","Autonomous robotic artworks tend to be perceived as living and intentional entities. We explore the way visitors interact with an artistic installation involving this original form of robots.","","early release","FinalAccept","","Labex ART-H2H","ANR-10-LABX-80-01","","","","","Jan  9 04:28",""
"case167","A","Testing the Effectiveness of iPad Math Game: Lessons Learned from Running a Multi-Classroom Study","Kristen","Blair","kpilner@stanford.edu","case0167-paper.pdf","8","letter","","","Kristen Pilner Blair, Jay Pfaffman, Maria Cutumisu, Nicole Hallinen, Daniel Schwartz","kpilner@stanford.edu, pfaffman@stanford.edu, cutumisu@stanford.edu, hallinen@stanford.edu, daniel.schwartz@stanford.edu","47834","Kristen","Pilner","Blair","kpilner@stanford.edu","Stanford Graduate School Of Education","Stanford University","Stanford","CA","94305","","","","","","47910","Jay","","Pfaffman","pfaffman@stanford.edu","College of Education","University of South Alabama","Mobile","Alabama","United States","","","","","","47911","Maria","","Cutumisu","cutumisu@stanford.edu","Stanford Graduate School of Education","Stanford University","Stanford","California","United States","","","","","","47912","Nicole","","Hallinen","hallinen@stanford.edu","Stanford Graduate School of Education","Stanford University","Stanford","California","United States","","","","","","47913","Daniel","","Schwartz","daniel.schwartz@stanford.edu","Stanford Graduate School of Education","Stanford University","Stanford","California","United States","","","","","","","","","","","","","","","","","","","","","","","","","","","","","","","","","","","","","","","","","","","","","","","","","","","","","","","","","","","","","","","","","","","","","","","","","","","","","","","","","Kristen Pilner Blair","kpilner@stanford.edu","Many educational products designed for young children go through extensive user testing, but rarely through a rigorous examination of whether they improve learning. We describe our experiences and lessons learned from conducting a multi-classroom study to examine learning from an iPad math app we developed for preschool and kindergarten children. Focusing on the research experience itself, we describe six common challenges to conducting learning research with technology and young children, as well as six principles to help mitigate the challenges. This paper is intended to help others who wish to assess learning from educational games for children.","1. Blair, K. P. Learning in Critter Corral. In Proc. Interaction Design and Children 2013. ACM Press (2013),372-375. \ 2. Chiong, C. and Shuler, C. Learning: Is there an app for that? Investigations of young children’s learning with mobile devices and apps. Joan Ganz Cooney Center, New York, 2010. \ 3. Gee, J. P. What Video Games Have to Teach Us About Learning and Literacy. Palgrave/Macmillan, New York, 2003. \ 4. Griffin, S. A., Case, R., and Siegler, R. S. 1994. Rightstart: Providing the central conceptual prerequisites for first formal learning of arithmetic to students at risk for school failure. In K. McGilly (Ed.), Classroom lessons: Integrating cognitive theory and classroom practice MIT Press, Cambridge, 1994, 25–49. \ 5. Habgood, M.P.J and Ainsworth, S.E. Motivating Children to Learn Effectively: Exploring the value of intrinsic integration in educational games. Journal of the Learning Sciences, 20, 2 (2011), 169-206. \ 6. Markopoulos, P, Reed, J.C., MacFarlane, S., and Hoysniemi, J. Evaluating children's interactive products: principles and practices for interaction designers. Morgan Kaufmann, Burlington, 2008. \ 7. O’Hare, E. Mobile Apps for Children. Criteria and Categorization, Cinekid,2014. \ 8. Okita, S. and Schwartz, D. L. Learning by Teaching Human Pupils and Teachable Agents. Journal of the Learning Sciences, 22, 3 (2013), 375-412. \ 9. Plowman, L., McPake, J., and Stephen, C. The Technologisation of Childhood? Young children and technology in the home. Children and Society, 24,1 (2008), 63-74. \ 10. Purpura, D. and Lonigan, C. Informal Numeracy Skills: The structure and relations among numbering, relations, and arithmetic operations in preschool. American Educational Research Journal, 50 (2013), 178-209. \ 11. Weiland, C., Wolfe, C. B., Hurwitz, M., Clements, D., Sarama, J. H., and Yoshikawa, H. Early Mathematics Assessment: Validation of the short form of a prekindergarten and kindergarten mathematics measure. Educational Psychology, 32, 3 (2012), 311-333. \ ","Learning Games; Evaluation Research; Mathematics Learning; Young Children ","H.5.1; K.3.1","case0167-file1.doc","","","","","","We discuss experiences conducting a multi-classroom study of learning from a math app for 4-5 year olds. We describe challenges of conducting learning research and principles to mitigate the challenges.","","early release","FinalAccept","","","","","","","","Jan 14 09:29",""
"case183","A","Colormaps that Improve Perception of High-Resolution Ocean Data","Francesca","Samsel","figs@cat.utexas.edu","case0183-paper.pdf","8","letter","Helvetica,Bold Helvetica Arial,Bold Arial","","Francesca Samsel, Mark Petersen, Terece Geld, Greg Abram, Joanne Wendelberger, James Ahrens","figs@cat.utexas.edu, mpetersen@lanl.gov, tgeld@cat.utexas.edu, gda@tacc.utexas.edu, joanne@lanl.gov, ahrens@lanl.gov","47875","Francesca","","Samsel","figs@cat.utexas.edu","Center for Agile Technology","University of Texas at Austin","Austin","TX","USA","","","","","","47923","Mark","","Petersen","mpetersen@lanl.gov","COSIM","Los Alamos National Lab","Los Alamos","New Mexico","United States","","","","","","47922","Terece","","Geld","tgeld@cat.utexas.edu","Center for Agile Technology","University of Texas at Austin","Austin","Texas","USA","","","","","","47924","Greg","","Abram","gda@tacc.utexas.edu","TACC","The University of Texas at Austin","Austin","Texas","United States","","","","","","47925","Joanne","","Wendelberger","joanne@lanl.gov","Statistic Sciences Group","Los Alamos National Lab","Los Alamos","New Mexico","United States","","","","","","47926","James","","Ahrens","ahrens@lanl.gov","Data Science at Scale","Los Alamos National lab","Los Alamos","New Mexico","United States","","","","","","","","","","","","","","","","","","","","","","","","","","","","","","","","","","","","","","","","","","","","","","","","","","","","","","","","","","","","","","","","","","Francesca Samsel","figs@cat.utexas.edu","Scientists from the Climate, Ocean and Sea Ice Modeling Team (COSIM) at the Los Alamos National Laboratory (LANL) are interested in gaining a deeper understanding of three primary ocean currents: the Gulf Stream, the Kuroshio Current, and the Agulhas Current & Retroflection. To address these needs, visual artist Francesca Samsel teamed up with experts from the areas of computer science, climate science, statistics, and perceptual science.  By engaging an artist specializing in color, we created colormaps that provide the ability to see greater detail in these high-resolution datasets.  The new colormaps applied to the POP dataset enabled scientists to see areas of interest unclear using standard colormaps.  Improvements in the perceptual range of color allowed scientists to highlight structures within specific ocean currents. Work with the COSIM team members drove development of nested colormaps which provide further detail to the scientists.","References and Citations \ [1]	Rogowitz, B., Treinsh, L., “Data Visualization: the end of the rainbow.” Spectrum, IEEE (1998) 35:12(52-59).  \ [2]	Ware, C., Information Visualization: Perception for Design. Morgan Kaufmann Publishers, Waltham, MA, USA, 2013. \ [3]	Wyszecki, G., and Stiles, W.S.  Color Science: Concepts and Methods, Quantitative Data and Formulae, 2nd Edition.  John Wiley & Sons, Inc., New York, NY, 1982. www.cie.co.at. \ [4]	Adobe Technical guides, http://dba.med.sc.edu/price/irf/Adobe_tg/models/cielab.html \ [5]	Moreland, K., Diverging Colormaps for Scientific Visualization, http://www.sandia.gov/~kmorel/documents/ColorMaps \ [6]	Borland, D., Taylor II, R., ""Rainbow Color Map (Still) Considered Harmful,"" IEEE Computer Graphics and Applications, 27(2):14-17, 2007.  \ [7]	Albers, J., Interaction of Color. Yale University Press, 1963. \ [8]	Itten, J., Birren, F., The Elements of Color: A Treatise on the Color System of Johannes Itten, Based on His Book The Art of Color.  Van Nostrand Reinhold, 1970. \ [9]	Rogowitz, B.E., Treinish, L.A., Bryson, S., “How not to lie with visualization.” Comput Phys., 10(3):268-273, 1998. \ [10] Parallel Ocean Program, http://oceans11.lanl.gov/drupal/POP. \ [11] Maltrud, M. E., and J. L. McClean, An eddy resolving global 1/10° ocean simulation. Ocean Modelling, 8, 1-2, 31-54, 2005. \ [12] Buhrmester, M.D., Kwang, T., Gosling, S.D.  Amazon’s Mechanical Turk: A new source of inexpensive, yet high-quality, data? Perspectives on Psychological Science, 6, 3-5, 2001. \ [13]  Paolacci, G., Chandler, J., Ipeirotis, P.G. Running Experiments on Amazon Mechanical Turk.  Judgement and Decision Making, 5(5):411-419, 2010. \ [14] Model for Prediction Across Scales (MPAS), http://mpas-dev.github.io/. \  \   \ ","Colormaps; color theory; color perception; climate science; scientific visualization; high-resolution datasets","H.1.2; H.5.2; I.3.m","case0183-file1.docx","case0183-file2.jpg","","","Through a novel approach to colormap construction, this art-science-visualization collaboration developed a system of colormapping that revealed greater detail within ocean structures, positively impacting climate research.  ","","We have built and tested colormaps enabling scientists to see greater detail within their data.","","","FinalAccept","","U.S. Department of Energy Office of Science","DE-SC-0012516","U.S. Department of Energy Office of Science","LA-UR-15-20105","","","Jan 21 15:23",""
