"case129","A","Rapid Usability Assessment of an Enterprise Application in an Agile Environment with CogTool","Anil","Shankar","anil@platfora.com","case0129-paper.pdf","8","letter","","","Anil Shankar, Honray Lin, Hans-Frederick Brown, Colson Rice Rice","anil@platfora.com, ray@platfora.com, hans@platfora.com, colrice@indiana.edu","47550","Anil","","Shankar","anil@platfora.com","","Platfora Inc.","SAN MATEO","California","USA","","","","","","50071","Honray","","Lin","ray@platfora.com","Platfora Inc, San Mateo, California, United States","Platfora Inc","San Mateo","California","United States","","","","","","47595","Hans-Frederick","","Brown","hans@platfora.com","","Platfora Inc","San Mateo","California","United States","","","","","","25314","Colson Rice","","Rice","colrice@indiana.edu","","Indiana University Bloomington","Bloomington","Indiana","United States","","","","","","","","","","","","","","","","","","","","","","","","","","","","","","","","","","","","","","","","","","","","","","","","","","","","","","","","","","","","","","","","","","","","","","","","","","","","","","","","","","","","","","","","","","","","","","","","Anil Shankar","anil@platfora.com","Lab based user testing with participants quickly becomes a bottleneck for UX teams in the industry that exist in an Agile software development environment characterized by frequent release cycles and continually changing requirements. For such teams to reduce this testing time and to quickly glean usability insights we leverage human performance modeling via CogTool. Our work compares CogTool’s expert user model’s task time with actual user time from lab sessions in two user studies. In these two studies CogTool’s task time estimates were statistically significantly lower when compared to lab based user times but the two task times were positively correlated. We leverage this correlation between CogTool task times and lab user times to build a predictive user model. Next, we apply this user model to rapidly evaluate two new designs without lab based user testing. Based on these results we provide recommendations for Agile UX teams to harness CogTool for enhancing user research efforts and thereby reduce the bottleneck of lab based user testing.","1. Cogtool. http://cogtool.com. Accessed: 2014-09-30. \ 2. Platfora. http://www.platfora.com. Accessed: 2014-09-30. \ 3. Beck, K., Beedle, M., van Bennekum, A., Cockburn, A., Cunningham, W., Fowler, M., Grenning, J., Highsmith, J., Hunt, A., Jeﬀries, R., Kern, J., Marick, B., Martin, R. C., Mallor, S., Shwaber, K., and Sutherland, J. The Agile Manifesto. 2001. \ 4. Bellamy, R., John, B., and Kogan, S. Deploying cogtool: integrating quantitative usability assessment into real-world software development. Software Engineering, International Conference on (2011), 691–700. \ 5. Blackmon, M. H., Kitajima, M., and Polson, P. G. Tool for accurately predicting website navigation problems, non-problems, problem severity, and eﬀectiveness of repairs. In Proceedings of the SIGCHI Conference on Human Factors in Computing Systems, CHI ’05, ACM (New York, NY, USA, 2005), 31–40. \ 6. Brooke, J. Sus: A quick and dirty usability scale, 1996. \ 7. Card, S. K., Newell, A., and Moran, T. P. The Psychology of Human-Computer Interaction. L. Erlbaum Associates Inc., Hillsdale, NJ, USA, 1983. \ 8. Gothelf, J., and Seiden, J. Lean UX: Applying Lean Principles to Improve User Experience, 1st edition ed. No. ISBN-10: 1449311652. O’Reilly Media, 2013. \ 9. John, B. E. Using predictive human performance models to inspire and support ui design recommendations. In Proceedings of the SIGCHI Conference on Human Factors in Computing Systems, CHI ’11, ACM (New York, NY, USA, 2011), 983–986. \ 10. John, B. E., Prevas, K., Salvucci, D. D., and Koedinger, K. Predictive human performance modeling made easy. In Proceedings of the SIGCHI Conference on Human Factors in Computing Systems, CHI ’04, ACM (New York, NY, USA, 2004), 455–462. \ 11. Kuniavsky, M. Observing the User Experience: A Practitioner’s Guide to User Research (Morgan Kaufmann Series in Interactive Technologies) (The Morgan Kaufmann Series in Interactive Technologies). Morgan Kaufmann Publishers Inc., San Francisco, CA, USA, 2003. \ 12. Luo, L., and John, B. E. Predicting task execution time on handheld devices using the keystroke-level model. In CHI ’05 Extended Abstracts on Human Factors in Computing Systems, CHI EA ’05, ACM (New York, NY, USA, 2005), 1605–1608. \ 13. Miller, C. S., and Remington, R. W. Modeling information navigation: Implications for information architecture. Hum.-Comput. Interact. 19, 3 (Sept. 2004), 225–271. \ 14. Montgomery, D. C., Peck, E. A., and Vining, G. G. Introduction to Linear Regression Analysis (4th ed.). Wiley & Sons, Hoboken, July 2006. \ 15. Oluwakemi, A. Assessing the accuracy of task time prediction of an emerging human performance modeling software - CogTool. PhD thesis, Louisiana State University, Baton Rouge, LA, USA, December 2013. \ 16. Teo, L., and John, B. E. Cogtool-explorer: Towards a tool for predicting user interaction. In CHI ’08 Extended Abstracts on Human Factors in Computing Systems, CHI EA ’08, ACM (New York, NY, USA, 2008), 2793–2798. \ ","CogTool; Cognitive Modeling; User Experience Research; Agile; Enterprise Software; User Modeling, Usability Engineering","H.5.m","case0129-file1.zip","","","","","","We outline an approach for Agile UX teams to reduce the bottleneck of lab based user testing by leveraging CogTool’s human performance modeling of an expert user. ","","","","","","","","","","","Jan  8 16:07",""
"case131","A","The 6th Finger: Practical Challenges in the Design of a Multitouch Audio Appliance","Wolfgang Beer","Beer","wolfgang.beer@scch.at","case0131-paper.pdf","7","letter","","","Wolfgang Beer, Christian Salomon, Mario Winterer, Karl Putzhammer, Bernhard Schauer, Thomas Rechberger","wolfgang.beer@scch.at, christian.salomon@scch.at, mario.winterer@scch.at, putzhammer@acousta.at, schauer@acousta.at, rechberger@acousta.at","45074","Wolfgang","","Beer","wolfgang.beer@scch.at","Software Competence Center Hagenberg GmbH","Software Analytics and Evolution","Hagenberg","","Austria","","","","","","47610","Christian","","Salomon","christian.salomon@scch.at","Software Competence Center Hagenberg GmbH","Software Analytics and Evolution","Hagenberg","","Austria","","","","","","47611","Mario","","Winterer","mario.winterer@scch.at","Software Competence Center Hagenberg GmbH","Software Analytics and Evolution","Hagenberg","","Austria","","","","","","47612","Karl","","Putzhammer","putzhammer@acousta.at","","Acousta Engineering","Salzburg","","Austria","","","","","","47613","Bernhard","","Schauer","schauer@acousta.at","","Acousta Engineering","Salzburg","","Austria","","","","","","47614","Thomas","","Rechberger","rechberger@acousta.at","","Acousta Engineering","Salzburg","","Austria","","","","","","","","","","","","","","","","","","","","","","","","","","","","","","","","","","","","","","","","","","","","","","","","","","","","","","","","","","","","","","","","","","Christian Salomon","christian.salomon@scch.at","Effective multitouch interaction does not reduce itself to a simple tracking of five fingers, there are several emerging effects that could prevent intuitive interaction in industrial appliances. This use-case describes practical challenges that were documented during the design and implementation of a holistic user interaction design in the domain of high-end audio equipments. The engineering process had to combine tangible user interface controls with state-of-the-art multitouch software fader panels in an intuitive way. This work also gives some background information about complex distributed audio routing equipment and user interaction along with technology and usability issues that appear during the design of a multitouch appliance. Several experiments were implemented in order to gain empiric data to substantiate our practical findings.    \ ","1. Adelstein, B. D., Begault, D. R., Anderson, M. R., and Wenzel, E. M. Sensitivity to haptic-audio asynchrony. In Proceedings of the 5th International Conference on Multimodal Interfaces, ICMI ’03, ACM (New York, NY, USA, 2003), 73–76. \ 2. Banerjee, A., Burstyn, J., Girouard, A., and Vertegaal, R. Waveform: Remote video blending for vjs using in-air multitouch gestures. In CHI ’11 Extended Abstracts on Human Factors in Computing Systems, CHI EA ’11, ACM (New York, NY, USA, 2011), 1807–1812. \ 3. Blaica, B., VladuˇsIˇc, D., and Mladeni´c, D. Mti: A method for user identiﬁcation for multitouch displays. Int. J. Hum.-Comput. Stud. 71, 6 (June 2013), 691–702. \ 4. Hansen, T. E., Hourcade, J. P., Virbel, M., Patali, S., and Serra, T. Pymt: A post-wimp multi-touch user interface toolkit. In Proceedings of the ACM International Conference on Interactive Tabletops and Surfaces, ITS ’09, ACM (New York, NY, USA, 2009), 17–24. \ 5. Kin, K., Hartmann, B., DeRose, T., and Agrawala, M. Proton++: A customizable declarative multitouch framework. In Proceedings of the 25th Annual ACM Symposium on User Interface Software and Technology, UIST ’12, ACM (New York, NY, USA, 2012), 477–486. \ 6. Lopes, P. A., Ferreira, A., and Pereira, J. A. M. Multitouch interactive djing surface. In Proceedings of the 7th International Conference on Advances in Computer Entertainment Technology, ACE ’10, ACM (New York, NY, USA, 2010), 28–31. \ 7. Scholliers, C., Hoste, L., Signer, B., and De Meuter, W. Midas: A declarative multi-touch interaction framework. In Proceedings of the Fifth International Conference on Tangible, Embedded, and Embodied Interaction, TEI ’11, ACM (New York, NY, USA, 2011), 49–56. \ 8. Sears, A., and Shneiderman, B. High precision touchscreens: Design strategies and comparisons with a mouse. Int. J. Man-Mach. Stud. 34, 4 (Apr. 1991), 593–613. \ ","Multitouch gestures; product development; audio editing; audio routing;","H.5.2","case0131-file1.tex","case0131-file2.jpg","","","This image shows three audio channels that are modified by multitouch user interaction.","","This case study gives a detailed description about practical issues during the design of a multitouch appliance in the domain of audio editing and routing. ","According to the detailed reviews we introduced a detailed description about the user interface and we corrected the position of all figures to appear right beside the text parts where they belong to. \ We also made a short description why we chose this title 'The 6th Finger ...' \ ","early release","","","","","","","","","Jan  6 02:26",""
"case133","A","Industry Is Changing, And So Must We","Umer","Farooq","umfarooq@microsoft.com","case0133-paper.pdf","7","letter","Helvetica,Bold Arial","","Umer Farooq, Joseph T Munko","umfarooq@microsoft.com, jmunko@microsoft.com","1864","Umer","","Farooq","umfarooq@microsoft.com","","Microsoft Corporation","Redmond","Washington","United States","","","","","","46241","Joseph","T","Munko","jmunko@microsoft.com","Operating Systems Group User Research","Microsoft Corporation","Redmond","Washington","United States","","","","","","","","","","","","","","","","","","","","","","","","","","","","","","","","","","","","","","","","","","","","","","","","","","","","","","","","","","","","","","","","","","","","","","","","","","","","","","","","","","","","","","","","","","","","","","","","","","","","","","","","","","","","","","","","","","","","","","","","","","","","","","Umer Farooq","umfarooq@microsoft.com","This case study is a call to action for research practitioners and academicians to revamp their skills and curriculum respectively. Failure to evolve will likely marginalize the user research discipline in industry.","1. Bannon, L. Reimagining HCI: Toward a More Human-Centered Perspective. ACM Interactions, ACM Press, 18, 4 (2011), 50-57. \ 2. Buie, E., Dray, S., Instone, K., Jain, J., Lindgaard, G., and Lund, A. How to bring HCI research and practice closer together. Proceedings of CHI (2010) Extended Abstracts, ACM Press, 3181-3184. \ 3. Capability Maturity Model. http://whatis.cmmiinstitute.com. \ 4. Carroll, J.M. Making Use: Scenario-Based Design of Human-Computer Interactions. The MIT Press, Cambridge, MA, USA, 2000. \ 5. Czerwinski, M., Dringus, L., Sears, A., and Thomas, B.B. Educating HCI practitioners: Evaluating what industry needs and what academia delivers. Proceedings of CHI (1996) Conference Companion, ACM Press, 425. \ 6. Farooq, U., Welicki, L., and Zirkler, D. API usability peer reviews: A method for evaluating the usability of Application Programming Interfaces. Proceedings of CHI (2010), ACM Press, 2327-2336. \ 7. Grudin, J. Groupware and social dynamics: Eight challenges for developers. Communications of the ACM, 37, 1 (1994), 92-105. \ 8. Grudin, J. When A/B Testing Gets an F. ACM Interactions Blog, ACM Press (2013), 8:33:18. \ 9. Grudin, J. and Farooq, U. Where to go after grad school: A discussion about jobs and careers. DUB talk at University of Washington (October 13, 2010). http://vimeo.com/16296017. \ 10. Perlman, G., Ephrath, A.R., Hewett, T.T., Long, J., Mountford, S.J., and Preece, J. Is HCI education getting a passing grade from industry? Proceedings of CHI (1994) Conference Companion, ACM Press, 189-190. \ 11. Rosson, M.B. and Carroll, J.M. Usability Engineering: Scenario-Based Development of HumanComputer Interaction. Morgan Kaufmann Publishers, San Francisco, CA, USA, 2002. \ 12. Siroker, D. and Koomen, P. A/B Testing: The Most Powerful Way to Turn Clicks into Customers. John Wiley & Sons, Inc., Hoboken, NJ, USA, 2013. \ 13. UserTesting.com. http://www.usertesting.com. \ 14. UXPA. https://uxpa.org. \ ","Data Science; Large Software Organizations; Usability; Academia","H.5.m. Information interfaces and presentation (e.g., HCI): Miscellaneous","case0133-file1.doc","","","","","","This case study is a call to action for research practitioners and academicians to revamp their skills and curriculum respectively.","","early release","","","","","","","","","Jan  8 17:15",""
"case134","A","Voice or Gesture in the Operating Room","Helena","Mentis","mentis@umbc.edu","case0134-paper.pdf","8","letter","","incomplete","Helena M. Mentis, Kenton P O'Hara, Gerardo Gonzalez, Abigail Sellen, Robert Corish, Antonio Criminisi, Rikin Trivedi, Pierre Theodore","mentis@umbc.edu, oharakenton@gmail.com, gerardo.gonzalez@kcl.ac.uk, asellen@microsoft.com, rcorish@microsoft.com, antcrim@microsoft.com, rikin.trivedi@addenbrookes.nhs.uk, pierre.theodore@ucsfmedctr.org","1960","Helena","M.","Mentis","mentis@umbc.edu","","University of Maryland, Baltimore County","Baltimore","Maryland","United States","","","","","","6210","Kenton","P","O'Hara","oharakenton@gmail.com","","Microsoft Research","Cambridge","","United Kingdom","","","","","","47673","Gerardo","","Gonzalez","gerardo.gonzalez@kcl.ac.uk","Dept. of Biomedical Engineering","King's College, London","London","","United Kingdom","","","","","","1515","Abigail","","Sellen","asellen@microsoft.com","","Microsoft Research Cambridge","Cambridge","","United Kingdom","","","","","","31452","Robert","","Corish","rcorish@microsoft.com","","Microsoft Research","Cambridge","Cambridgeshire","United Kingdom","","","","","","47674","Antonio","","Criminisi","antcrim@microsoft.com","","Microsoft Research Cambridge","Cambridge","","United Kingdom","","","","","","47675","Rikin","","Trivedi","rikin.trivedi@addenbrookes.nhs.uk","","Addenbrookes Hospital","Cambridge","","United Kingdom","","","","","","45990","Pierre","","Theodore","pierre.theodore@ucsfmedctr.org","","University of California San Francisco Medical Center","San Francisco","California","United States","","","","","","","","","","","","","","","","","","","","","","","","","","","","","","","","","","","","Helena Mentis","mentis@umbc.edu","This case study represents our efforts to investigate the uses of voice control versus gestural control in the OR.  We present a system we expressly built to allow for both gestural or voice control at the choice of the surgeon. We explain our deployment of this system in the context of cardiothoracic surgery and present a vignette on how the system was used in the moment by the attending surgeon. We learn that, in terms of design, its not just a question of saying voice is better for one type of functionality and gesture is better for another; rather, the benefits are circumstantial. Thus, there is a case for building in redundancy in control with both voice and gesture.","1. Allaf, M Jackman, S., Schulam, P., Cadeddu, J., Lee, B., Moore, R. and Kavoussi, L. (1998) Laparoscopic visual field: Voice vs. foot pedal interfaces for control of the AESOP robot. In Surgical Endoscopy, 12(12) pp. 1415–1418. \ 2. Carpintero, E., Perez, C., Morales, R., Garcia, N., Candela, A. and Azorin, J. (2010) Development of a robotic scrub nurse for the operating theatre. In Biomedical Robotics and Biomechatronics (BioRob) 2010, pp. 504 –509 \ 3. Ebert, L., Hatch, G., Ampanozi, G., Thali, M., and Ross, S. (2011) You Can’t Touch This: Touch-free Navigation Through Radiological Images. In Surgical Innovation,19(3), pp. 301-307. \ 4. Gallo, L. Alessio Pierluigi Placitelli, A.P. Mario Ciampi, M. (2011) Controller-free exploration of medical image data: experiencing the Kinect. In Proceedings of 24th International Symposium on Computer-Based Medical Systems (CBMS), Bristol, UK. \ 5. Graetzel, C., Fong, T., Grange, S., Baur, C. (2004) A Non-Contact Mouse for Surgeon-Computer Interaction. In Technology and Health Care,12. \ 6. Johnson, R., O’Hara, K., Sellen, A., Cousins, C., & Criminisi, A. (2011). Exploring the potential for touchless interaction in image-guided interventional radiology. In Proc. of CHI 2011, Vancouver, Canada, pp. 3323-3332. \ 7. Kipshagen, T., Graw, M., Tronnier, V.,.Bonsanto, M. and Hofmann, U. (2009) Touch- and marker-free interaction with medical software. In Proc. of WC ’09, pp75–78. \ 8. Kochan, A. (2005) Scalpel please, robot: Penelope’s debut in the operating room. In Industrial Robot, 32(6), pp. 449–451, 2005. \ 9. Mentis, H., O’Hara, K., Sellen, A. and Trivedi, R. (2012) Interaction Proxemics and Image Use in Neurosurgery. In Proceedings of CHI 2012, Austin, Texas. \ 10. O’Hara, K., Gonzalez, G., Penney, G., Sellen, A. Corish, R., Sellen, A. et al (2014) Interactional Order and Constructed Ways of Seeing with Touchless Imaging Systems in Surgery. In Journal of Computer Supported Cooperative Work, 3(23). \ 11. O’Hara, K., Mentis, H. Sellen, A. et al (2014) Touchless Interaction in Surgical Settings. In Communications of the ACM, 57 (01), pp70-77. \ 12. Ruppert, G., Amorim, P., Moares, T., and Silva, J. (2011) Touchless Gesture User Interface for 3D Visualization using Kinect Platform and Open-Source Frameworks. In Proc. of the 5th International Conference on Advanced Research in Virtual and Rapid Prototyping, Leiria, Portugal, pp 215–219. \ 13. Stern, H., Wachs, J. and Edan. Y. (2008) Optimal Consensus Intuitive Hand Gesture Vocabulary Design. In Proc. of ICSC '08, Washington, DC, USA, 96-103. \ 14. Vara-Thorbeck, C., Murioz, V., Toscano, R., Gomez, J., Fernandez, J.,Felices, M. and GarciaCerezo, A. (2001) A new robotic endoscope manipulator a preliminary trial to evaluate the performance of a voice-operated industrial robot and a human assistant in several simulated and real endoscopic operations. In Surgical Endoscopy, 15, pp. 924–927. \ ","Voice control; gesture; operating room","H.5.m","case0134-file1.doc","","","","","","","","","","","","","","","","","Jan  7 21:19",""
"case136","A","Photo Based Observation Method: How to quickly observe the behavior of the user","HeeJeong","Son","son.hee@navercorp.com","case0136-paper.pdf","7","letter","Helvetica,Bold Arial","","HeeJeong Son, Hyunsoo Kim, Hyojung Kim","son.hee@navercorp.com, hyunsoo.kim@navercorp.com, kim.hyojung@navercorp.com","47632","HeeJeong","","Son","son.hee@navercorp.com","UX Department","Naver Corp","Seongnam-si","","Korea, Republic of","","","","","","47633","Hyunsoo","","Kim","hyunsoo.kim@navercorp.com","UX Department","Naver Corp","Seongnam-si","","Korea, Republic of","","","","","","42509","Hyojung","","Kim","kim.hyojung@navercorp.com","UX Department, Naver Corp., Seongnam-si, Korea, Republic of","Naver Corp.","Seongnam-si","","Korea, Republic of","","","","","","","","","","","","","","","","","","","","","","","","","","","","","","","","","","","","","","","","","","","","","","","","","","","","","","","","","","","","","","","","","","","","","","","","","","","","","","","","","","","","","","","","","","","","","","","","","","","","","","","","","","","","","","","+82 10-5678-2023 (HeeJeong, Son)","son.hee@navercorp.com","Although users are still important in ever-changing mobile market, the time for understanding needs of the users is limited. In this context, we have utilized photos in observing the users in PBO method (Photo Based Observation Method) with which the behavioral pattern of the users can be easily and quickly discovered. PBO method has a 5-step research process – prediction, collection, classification, deduction and verification. Our 10 examiners, respectively, have taken photos of easily-witnessed user behaviors around each of them with their own smartphones for 7 days and we have collected and analyzed the photos. As a result, we found out 7 different patterns on how the users utilize their mobile devices. We expect such methodology to be useful in easily and quickly observing and collecting a common behavioral pattern of multiple users, providing us an opportunity to discover the users’ needs through their natural actions. ","1. Frog Mob. http://frogmob.frogdesign.com \ 2. IDEO, Thoughtless acts (2005) http://www.ideo.com/by-ideo/thoughtless-acts \ ","Photo Research; PBO method; User-centered design; User research method; Mobile app; Mobile UI","D.2.2; D.2.10; H.5.2","case0136-file1.doc","","","","","","This case study suggests a method for easily and quickly observing user’s behavior through the photos collected by examiner without an additional research tool.","","early release","","","","","","","","","Jan  8 06:12",""
