ID,Date,Time,End Time,Track,Title,Chair(s) First Name,Chair(s) Last Name,Chair Affiliation,ChairAffiliation Country,Location,Notes,CHI code,Web Page,Submission ID1,Submission ID2,Submission ID3,Submission ID4,Submission ID5,Submission ID6
s-panel8,Tuesday,14:00,15:20,,"Interacting with Digital Individuals: Opportunities and Risks of Discovering Personality Traits from Social Media",,,,,716A,,,,pan118,,,,,
s-alt1,Monday,14:00,15:20,,"Understanding Interactions",Daniela,Rosner,"University of Washington",United States,717AB,,,,alt105,alt121,alt155,alt163,,
s-alt2,Monday,11:00,12:20,,"Ways of Knowing in HCI",Barry,Brown,,,717AB,,,,alt174,alt112,alt188,alt104,,
s-alt3,Tuesday,9:00,10:20,,"Ways of Creating in HCI",Silvia,Lindtner,"University of California, Irvine",United States,717AB,,,,alt101,alt133,alt145,alt170,,
s-alt4,Tuesday,11:00,12:20,,"Limits and Futures",Morgan,Ames,,,717AB,,,,alt172,alt119,alt107,alt168,,
s-alt5,Thursday,9:00,10:20,,"Intimate Interfaces",Conor,Linehan,,,717AB,,,,alt153,alt179,alt156,alt146,,
s-alt6,Wednesday,9:00,10:20,,"Navel Gazing",Lilly,Irani,"University of California, San Diego",USA,717AB,,,,alt109,alt143,alt191,alt116,,
s-crs162,Tuesday,9:00,10:20,,"Citizen Science: An Introduction",,,,,713AB,,,,crs162,,,,,
s-crs163,Thursday,14:00,15:20,,"A Conversation with Susan Dray: Uncovering the Ordinary, Inspiring the Extraordinary",,,,,713AB,,,,crs163,,,,,
